{
  "schema_version": 1,
  "status": "proposed_pending_professor_review",
  "aspect_ratio": "16:9",
  "width_inches": "13.333333",
  "height_inches": "7.5",
  "safe_margin_inches": "0.5",
  "background": "#FFFFFF",
  "foreground": "#172B4D",
  "accent": "#005A70",
  "font_family": "Arial",
  "title_pt": 36,
  "cover_pt": 44,
  "body_pt": 24,
  "equation_pt": 28,
  "caption_pt": 20,
  "footer_pt": 18,
  "word_body_pt": 12,
  "word_heading1_pt": 20,
  "word_heading2_pt": 16,
  "word_heading3_pt": 13,
  "word_equation_pt": 14,
  "word_caption_pt": 11,
  "word_page": "A4",
  "word_margin_mm": 25,
  "word_heading_colour": "#000000",
  "figure_editable": true,
  "notes_audience": "public_student"
}
